[
    {
        "id": 21454348,
        "name": "id incididunt nostrud ad",
        "description": "mollit",
        "displayName": "cillum",
        "region": "NA",
        "tier": "MAJOR",
        "nodeGroups": [
            {
                "id": 77373956,
                "name": "nisi incididunt consequat magna",
                "nodeGroupType": "ORGANIZATIONAL",
                "round": 1,
                "nodes": [
                    {
                        "id": 71318461,
                        "scheduledTime": 1658723365415,
                        "actualTime": 1658769242953,
                        "nodeType": "BEST_OF_FIVE",
                        "hasStarted": false,
                        "isCompleted": false,
                        "teamOne": {
                            "id": 8,
                            "name": "BOOM Esports",
                            "tag": "BOOM"
                        },
                        "teamTwo": {
                            "id": 10,
                            "name": "Fnatic",
                            "tag": "Fnatic"
                        },
                        "streams": [
                            {
                                "id": 0,
                                "languageId": "ENGLISH",
                                "name": "Amazing Dota 2 Stream",
                                "streamUrl": "https://twitch.tv/dreamleague"
                            },
                            {
                                "id": 0,
                                "languageId": "ENGLISH",
                                "name": "Amazing Dota 2 Stream",
                                "streamUrl": "https://twitch.tv/dreamleague"
                            },
                            {
                                "id": 0,
                                "languageId": "ENGLISH",
                                "name": "Amazing Dota 2 Stream",
                                "streamUrl": "https://twitch.tv/dreamleague"
                            },
                            {
                                "id": 0,
                                "languageId": "ENGLISH",
                                "name": "Amazing Dota 2 Stream",
                                "streamUrl": "https://twitch.tv/dreamleague"
                            }
                        ]
                    },
                    {
                        "id": 9124251,
                        "scheduledTime": 1658753203497,
                        "actualTime": 1658694538206,
                        "nodeType": "BEST_OF_FIVE",
                        "hasStarted": false,
                        "isCompleted": false,
                        "teamOne": {
                            "id": 8,
                            "name": "BOOM Esports",
                            "tag": "BOOM"
                        },
                        "teamTwo": {
                            "id": 9,
                            "name": "Evil Geniuses",
                            "tag": "EG"
                        },
                        "streams": [
                            {
                                "id": 0,
                                "languageId": "ENGLISH",
                                "name": "Amazing Dota 2 Stream",
                                "streamUrl": "https://twitch.tv/dreamleague"
                            }
                        ]
                    },
                    {
                        "id": 90486676,
                        "scheduledTime": 1658708129712,
                        "actualTime": 1658751601421,
                        "nodeType": "BEST_OF_FIVE",
                        "hasStarted": false,
                        "isCompleted": false,
                        "teamOne": {
                            "id": 8,
                            "name": "BOOM Esports",
                            "tag": "BOOM"
                        },
                        "teamTwo": {
                            "id": 6,
                            "name": "Tundra Esports",
                            "tag": "Tundra"
                        },
                        "streams": [
                            {
                                "id": 0,
                                "languageId": "ENGLISH",
                                "name": "Amazing Dota 2 Stream",
                                "streamUrl": "https://twitch.tv/dreamleague"
                            },
                            {
                                "id": 0,
                                "languageId": "ENGLISH",
                                "name": "Amazing Dota 2 Stream",
                                "streamUrl": "https://twitch.tv/dreamleague"
                            },
                            {
                                "id": 0,
                                "languageId": "ENGLISH",
                                "name": "Amazing Dota 2 Stream",
                                "streamUrl": "https://twitch.tv/dreamleague"
                            },
                            {
                                "id": 0,
                                "languageId": "ENGLISH",
                                "name": "Amazing Dota 2 Stream",
                                "streamUrl": "https://twitch.tv/dreamleague"
                            },
                            {
                                "id": 0,
                                "languageId": "ENGLISH",
                                "name": "Amazing Dota 2 Stream",
                                "streamUrl": "https://twitch.tv/dreamleague"
                            }
                        ]
                    },
                    {
                        "id": 3081119,
                        "scheduledTime": 1658768482278,
                        "actualTime": 1658748396683,
                        "nodeType": "BEST_OF_FIVE",
                        "hasStarted": false,
                        "isCompleted": false,
                        "teamOne": {
                            "id": 1,
                            "name": "Thunder Awaken",
                            "tag": "TA"
                        },
                        "teamTwo": {
                            "id": 6,
                            "name": "Tundra Esports",
                            "tag": "Tundra"
                        },
                        "streams": [
                            {
                                "id": 0,
                                "languageId": "ENGLISH",
                                "name": "Amazing Dota 2 Stream",
                                "streamUrl": "https://twitch.tv/dreamleague"
                            }
                        ]
                    }
                ]
            },
            {
                "id": 95977281,
                "name": "culpa",
                "nodeGroupType": "GSL",
                "round": 1,
                "nodes": [
                    {
                        "id": 59556887,
                        "scheduledTime": 1658695624137,
                        "actualTime": 1658753479235,
                        "nodeType": "BEST_OF_TWO",
                        "hasStarted": false,
                        "isCompleted": false,
                        "teamOne": {
                            "id": 2,
                            "name": "PSG.LGD",
                            "tag": "PSG.LGD"
                        },
                        "teamTwo": {
                            "id": 11,
                            "name": "Team Spirit",
                            "tag": "TSpirit"
                        },
                        "streams": [
                            {
                                "id": 0,
                                "languageId": "ENGLISH",
                                "name": "Amazing Dota 2 Stream",
                                "streamUrl": "https://twitch.tv/dreamleague"
                            },
                            {
                                "id": 0,
                                "languageId": "ENGLISH",
                                "name": "Amazing Dota 2 Stream",
                                "streamUrl": "https://twitch.tv/dreamleague"
                            },
                            {
                                "id": 0,
                                "languageId": "ENGLISH",
                                "name": "Amazing Dota 2 Stream",
                                "streamUrl": "https://twitch.tv/dreamleague"
                            },
                            {
                                "id": 0,
                                "languageId": "ENGLISH",
                                "name": "Amazing Dota 2 Stream",
                                "streamUrl": "https://twitch.tv/dreamleague"
                            }
                        ]
                    },
                    {
                        "id": 1629506,
                        "scheduledTime": 1658714921996,
                        "actualTime": 1658708668902,
                        "nodeType": "BEST_OF_THREE",
                        "hasStarted": false,
                        "isCompleted": false,
                        "teamOne": {
                            "id": 15,
                            "name": "Royal Never Give Up",
                            "tag": "RNG"
                        },
                        "teamTwo": {
                            "id": 12,
                            "name": "Team Aster",